<?xml version="1.0" encoding="UTF-8"?>

<!--
    Document   : C-01.xml
    Created on : November 25, 2009, 4:24 PM
    Author     : Scalene
    Description:
        Purpose of the document follows.
-->

<!DOCTYPE player SYSTEM "Player.dtd">
<player>
    <city>
        <inner>1</inner>
        <outer>1</outer>
        <frontier>1</frontier>
    </city>
    <cardTotal>3</cardTotal>
    <deck>
        <card><cardid>1</cardid><cardnum>1</cardnum></card>
        <card><cardid>2</cardid><cardnum>1</cardnum></card>
        <card><cardid>3</cardid><cardnum>1</cardnum></card>
    </deck>
</player>
